{"schema_version": "1.0", "task_id": "T-COSTPROOF", "run_id": "run-20260929-costproof-001", "created_at": "2026-09-29T16:59:44.500196+00:00", "scope_ref": {"path": "runs/run-20260929-costproof-001/scope.json"}, "findings_ref": {"path": "runs/run-20260929-costproof-001/findings.json", "finding_ids": ["F-1", "F-2", "F-3", "F-4", "F-5", "F-6", "F-7", "F-8", "F-9", "F-10"]}, "minimal_change_rung": 2, "minimal_change_rationale": "Reused Money.__post_init__'s existing isinstance(x, bool) or not isinstance(x, int) validation idiom (demo-repo/src/loanflow/primitives.py:23-25) verbatim in Percentage.__post_init__, adding only the type check ahead of the existing negative-value check; no new helper, method, or dependency was introduced.", "changed_files": [{"path": "demo-repo/src/loanflow/primitives.py", "change_type": "modified", "lines_added": 2, "lines_removed": 0}, {"path": "demo-repo/tests/unit/test_primitives.py", "change_type": "modified", "lines_added": 9, "lines_removed": 0}], "commands": [{"id": "C-1", "stage": "pre_implementation", "command": "python -m pytest tests/unit/test_primitives.py -k test_percentage_rejects_non_integer_and_bool_basis_points -v", "exit_code": 1, "output_ref": "runs/run-20260929-costproof-001/logs/C-1.log"}, {"id": "C-2", "stage": "post_implementation", "command": "python -m pytest tests/unit/test_primitives.py -v", "exit_code": 0, "output_ref": "runs/run-20260929-costproof-001/logs/C-2.log"}], "test_first_evidence": {"pre_implementation_command_id": "C-1", "post_implementation_command_id": "C-2"}, "tests": [{"test_file": "demo-repo/tests/unit/test_primitives.py", "test_name": "test_percentage_rejects_non_integer_and_bool_basis_points", "status": "added"}], "dependency_changes": [], "status": "ready_for_verification"}
