{
  "schema_version": "1.0",
  "task_id": "T-LATEFEE2",
  "run_id": "run-20260805-latefee-005",
  "created_at": "2026-08-05T17:56:30Z",
  "scope_ref": {
    "path": "runs/run-20260805-latefee-005/scope.json"
  },
  "findings_ref": {
    "path": "runs/run-20260805-latefee-005/findings.json",
    "finding_ids": [
      "F-1",
      "F-4",
      "F-5",
      "F-9"
    ]
  },
  "minimal_change_rung": 2,
  "minimal_change_rationale": "Reused the existing validate-first-then-compare-thresholds convention from classify_credit_score in risk_bands.py (F-4) and the existing loanflow.errors.ValidationError exception type (F-5); the required return type is a plain str per the policy document (F-9), not an Enum, so only plain stdlib conditionals were needed -- no new helper, dependency, or exception type.",
  "changed_files": [
    {
      "path": "demo-repo/src/loanflow/late_fee_tier.py",
      "change_type": "modified",
      "lines_added": 15,
      "lines_removed": 7
    },
    {
      "path": "demo-repo/tests/unit/test_late_fee_tier.py",
      "change_type": "modified",
      "lines_added": 13,
      "lines_removed": 6
    }
  ],
  "diff_ref": "runs/run-20260805-latefee-005/diff.patch",
  "commands": [
    {
      "id": "C-1",
      "stage": "pre_implementation",
      "command": "python -m pytest tests/unit/test_late_fee_tier.py -v",
      "exit_code": 1,
      "output_ref": "runs/run-20260805-latefee-005/logs/C-1.log"
    },
    {
      "id": "C-2",
      "stage": "post_implementation",
      "command": "python -m pytest tests/unit/test_late_fee_tier.py -v",
      "exit_code": 0,
      "output_ref": "runs/run-20260805-latefee-005/logs/C-2.log"
    }
  ],
  "test_first_evidence": {
    "pre_implementation_command_id": "C-1",
    "post_implementation_command_id": "C-2"
  },
  "tests": [
    {
      "test_file": "demo-repo/tests/unit/test_late_fee_tier.py",
      "test_name": "test_late_fee_tier_boundaries",
      "status": "modified"
    },
    {
      "test_file": "demo-repo/tests/unit/test_late_fee_tier.py",
      "test_name": "test_negative_days_past_due_is_rejected",
      "status": "modified"
    }
  ],
  "dependency_changes": [],
  "status": "ready_for_verification"
}
