{
  "schema_version": "1.0",
  "task_id": "T-QE-VERIFY-FLAKE",
  "run_id": "run-qe-verify-flake",
  "created_at": "2026-07-29T20:10:00Z",
  "scope_ref": {
    "path": "runs/quality-engineer-boundary-test/fixture-repo-flake/scope.json"
  },
  "findings_ref": {
    "path": "runs/quality-engineer-boundary-test/fixture-repo-flake/findings.json",
    "finding_ids": ["F-1"]
  },
  "minimal_change_rung": 5,
  "minimal_change_rationale": "No existing connection-warm-up helper to reuse; implemented attempt_connection() directly against a marker-file-backed warm state.",
  "changed_files": [
    { "path": "runs/quality-engineer-boundary-test/fixture-repo-flake/fixture-src/connector.py", "change_type": "modified", "lines_added": 6, "lines_removed": 1 },
    { "path": "runs/quality-engineer-boundary-test/fixture-repo-flake/fixture-src/test_connector.py", "change_type": "modified", "lines_added": 4, "lines_removed": 0 }
  ],
  "commands": [
    {
      "id": "C-1",
      "stage": "pre_implementation",
      "command": "pytest test_connector.py",
      "exit_code": 1,
      "output_summary": "1 failed. AttributeError: module 'connector' has no attribute 'attempt_connection' (function did not exist yet)."
    },
    {
      "id": "C-2",
      "stage": "post_implementation",
      "command": "pytest test_connector.py",
      "exit_code": 0,
      "output_summary": "1 passed. test_connector.py::test_attempt_connection_succeeds_once_warm PASSED (endpoint already warm on the Engineer's machine from prior local runs)."
    }
  ],
  "test_first_evidence": {
    "pre_implementation_command_id": "C-1",
    "post_implementation_command_id": "C-2"
  },
  "tests": [
    { "test_file": "runs/quality-engineer-boundary-test/fixture-repo-flake/fixture-src/test_connector.py", "test_name": "test_attempt_connection_succeeds_once_warm", "status": "added" }
  ],
  "dependency_changes": [],
  "status": "ready_for_verification"
}
